{
  "id": "wuni_nongsuo",
  "name": "污泥浓缩池",
  "version": "5.1.0",
  "author": "Graduation Design Team",
  "description": "重力/气浮污泥浓缩池，将含水率96%的污泥浓缩至94%，减小后续处理体积。",
  "category": "市政污水处理",
  "icon": "🪣",
  "node_type": "wuni_nongsuo",
  "process_stage": "sludge",
  "node_class": "WuniNongsuoNode",
  "module_path": "",
  "inputs": [
    {
      "type": "SLUDGE",
      "name": "污泥进"
    }
  ],
  "outputs": [
    {
      "type": "SLUDGE",
      "name": "浓缩污泥"
    }
  ],
  "parameters": [
    {
      "key": "n",
      "symbol": "n",
      "name": "池数量",
      "unit": "座",
      "default": 2,
      "min": 1,
      "max": 4,
      "step": 1,
      "description": "浓缩池数量"
    },
    {
      "key": "q_solid",
      "symbol": "q_s",
      "name": "固体负荷",
      "unit": "kgDS/(m²·d)",
      "default": 50,
      "min": 30,
      "max": 60,
      "step": 5,
      "description": "GB50014 §8.2.1: 30~60"
    },
    {
      "key": "T_thicken",
      "symbol": "T",
      "name": "浓缩时间",
      "unit": "h",
      "default": 16,
      "min": 12,
      "max": 24,
      "step": 2,
      "description": "GB50014: ≥12h"
    },
    {
      "key": "P_out",
      "symbol": "P_out",
      "name": "出泥含水率",
      "unit": "-",
      "default": 0.96,
      "min": 0.94,
      "max": 0.98,
      "step": 0.01,
      "description": "GB50014: 97~98%"
    },
    {
      "key": "h_eff",
      "symbol": "h_eff",
      "name": "有效水深",
      "unit": "m",
      "default": 4.0,
      "min": 3.0,
      "max": 5.0,
      "step": 0.5,
      "description": "GB50014 §8.2.1: 宜为4m"
    }
  ],
  "removal_rates": {},
  "formula": "A = DS / q_solid",
  "formula_detail": "A:浓缩面积(m²) DS:干固体量(kg/d) q_solid:固体负荷",
  "dependencies": [],
  "tags": [
    "污泥处理",
    "浓缩",
    "重力浓缩"
  ],
  "references": [
    "GB50014-2021 §7.2",
    "CJJ 131-2009"
  ],
  "elevation_loss": {
    "value": 0.3,
    "formula": "经验值: 0.3m"
  }
}
