{
  "id": "wuni_bengzhan",
  "name": "污泥泵站",
  "version": "5.1.0",
  "author": "Graduation Design Team",
  "description": "污泥泵站，多股污泥汇集加压输送。含管道水力计算。",
  "category": "市政污水处理",
  "icon": "⚡",
  "node_type": "wuni_bengzhan",
  "process_stage": "sludge",
  "node_class": "WuniBengzhanNode",
  "module_path": "",
  "inputs": [
    {
      "type": "SLUDGE",
      "name": "污泥进"
    }
  ],
  "outputs": [
    {
      "type": "SLUDGE",
      "name": "污泥出"
    }
  ],
  "parameters": [
    {
      "key": "n_pumps",
      "symbol": "n",
      "name": "泵数量",
      "unit": "台",
      "default": 2,
      "min": 1,
      "max": 4,
      "step": 1,
      "description": "工作泵台数(不含备用)"
    },
    {
      "key": "Q_pump",
      "symbol": "Q",
      "name": "单泵流量",
      "unit": "m³/h",
      "default": 15,
      "min": 5,
      "max": 80,
      "step": 5,
      "description": "单台泵设计流量"
    },
    {
      "key": "H_pump",
      "symbol": "H",
      "name": "扬程",
      "unit": "m",
      "default": 20,
      "min": 10,
      "max": 60,
      "step": 2,
      "description": "水泵设计扬程"
    },
    {
      "key": "v_pipe",
      "symbol": "v",
      "name": "管道流速",
      "unit": "m/s",
      "default": 1.2,
      "min": 1.0,
      "max": 2.0,
      "step": 0.1,
      "description": "污泥管道经济流速"
    },
    {
      "key": "L_pipe",
      "symbol": "L",
      "name": "出水管长度",
      "unit": "m",
      "default": 100.0,
      "min": 10.0,
      "max": 500.0,
      "step": 10.0
    }
  ],
  "removal_rates": {},
  "formula": "D = √(4Q/(πv))",
  "formula_detail": "D:管径(m) Q:流量(m³/s) v:流速(m/s)",
  "dependencies": [],
  "tags": [
    "污泥处理",
    "泵站",
    "管道"
  ],
  "references": [
    "GB50014-2021 §7.1",
    "CJJ 131-2009"
  ],
  "elevation_loss": {
    "value": 0.0,
    "formula": "经验值: 0.0m"
  }
}
